id,hierarchy_level,ccta95_code,name,name_en,description,is_marked
"210333","minor","210333","プリズムメガネ（寝た状態で使用するメガネ）","Prismatic spectacles (recumbent spectacles)","寝たままで読書をしたりテレビを見たりするために，視線の方向を変えるプリズム式メガネ．通常，屈折矯正がない．中心視野に欠損があるため周辺視野で見る必要のある人が利用する．","0"
"210336","minor","210336","遮光レンズ","Light filters (absorption filters)","日差しの強いときに健常者がサングラスをかけるように，視覚障害者のまぶしさを軽減するために有効な補助具．吸収する光の波長や濃度の違いで多くの種類がある．","0"
"210600","middle","210600","電気光学的補助具","Electro-optical aids","視覚障害者が使用する補助具・機器のうち，光学及び電子工学の原理を利用したもの．ハードウェアばかりでなく，ソフトウェアも含む．","0"
"210603","minor","210603","拡大読書機（拡大テレビ）","Image-enlarging video systems","テレビカメラを用いて印刷物の文字などを拡大する補助具．前後左右にスライドできる台に印刷物などを乗せてテレビに拡大表示するタイプ，及び手持ち型のスキャナを書物に乗せて，スキャンした部分を拡大表示するタイプの２種類がある．カメラ，制御装置及びモニタディスプレイも含む．","0"
"210606","minor","210606","文字読みとり機","Character-reading machines","紙などに印刷された文字を読みとり，いったん電子的情報に変換した後，触覚・音声など他の情報形式に変換表示する装置．音声合成装置については210915を参照．","0"
"210689","minor","210689","その他の電気工学的補助具","Other electro-optical aids","","0"
"210900","middle","210900","コンピュータ・タイプライタ・電卓用入出力装置","Input and output units and accessories for computers, typewriters and calculators","コンピュータ・タイプライタ・電卓を使用する際に必要な入出力装置及び付属品．電話機・電話用機器は2136を参照．","0"
"210903","minor","210903","入力装置","Input units","音声認識装置，マウス，トラックボール，ジョイスティック，ペン入力装置などのデータを入力する装置．キーボード類及びキー操作を補助するための用具は210906，文字読みとり機は210606を参照．","0"
"210906","minor","210906","キーボード類及びキー操作を補助するための用具","Keyboards and control systems","さまざまな障害者用のキーボード（例えば視覚障害者用の点字キーボード，肢体不自由者用の大型キーボード，走査型キーボードなど）及びキーガードなどのキー操作を容易にする用具を含む．制御用機器については2409を参照のこと．","0"
"210908","minor","210908","視覚障害者用電子手帳","Portable electronic note-taking devices for braille users","視覚障害者が手軽に持ち運べ，現場で簡単にメモを打ち込んだり，打ち込んだ内容を音声又は点字で出力できる小型の機器．","0"
"210909","minor","210909","プリンタ・プロッタ","Printers and plotters","文字又は絵を紙に出力するコンピュータの出力装置．拡大文字，点字などの浮き出し文字を出力する装置も含む．","0"
"210912","minor","210912","ディスプレイ","Displays","コンピュータの出力表示装置のことで，ペーパレスの触覚ディスプレイ及びハードコピー機能を内蔵したディスプレイも含む．","0"
"210915","minor","210915","音声合成装置","Devices for synthetic speech","人工的に合成した音声を出力する装置で，規則合成方式の音声合成装置（テキスト情報を音声出力するもの），録音編集方式の音声合成装置，周波数帯域変換装置（聴覚障害者のために音声を聞きやすい周波数帯域に変換するもの）などを含む．人工喉頭は214212を参照．","0"
"210918","minor","210918","紙を取り扱うための付属品","Attachments for paper handling","肢体不自由者又は視覚障害者のために，プリンタ・タイプライタ用紙を取り扱いやすくするための付属品．そのような機構が標準としてプリンタ・タイプライタに含まれている場合は，プリンタ210909又はタイプライタ2115に含める．","0"
"210921","minor","210921","原稿ホルダ","Manuscript holders","肢体不自由者が，入力原稿を見ながらコンピュータなどへ文字を入力するときに原稿をおく台．","0"
"210924","minor","210924","タイプライタ・コンピュータ入力用前腕支持具","Forearm supports, applied to typewriter or computer","上肢機能に障害のある人が，タイプライタ及びコンピュータのキーボードをタイプする際に，前腕を支持するために用いる用具．非装着式上肢装具は0609を参照．","0"
"210927","minor","210927","入出力変換用ソフトウェア","Software for input and output modification","障害者のパソコン操作を容易にするためのソフトウェア．点字キーボードのような特殊なキーボードの入力を標準キーボードからの入力と同じ情報に変換するソフトウェア，画面へ出力された文字を合成音声で読み上げる画面読みソフト，弱視者のために画面を拡大するソフトウェアなどを含む．","0"
"211200","middle","211200","コンピュータ","Computers","個人で所有可能なワークステーション及びパーソナルコンピュータを扱う．ワープロ専用機は211509，コンピュータ・タイプライタ・電卓用入出力装置は2109，多目的ソフトウェアは2121を参照．","0"
"211500","middle","211500","タイプライタ・ワードプロセッサ","Typewriters and word-processors","作業用テーブルは180303，コンピュータ・タイプライタ・電卓用入出力装置は2109，多目的ソフトウェアは2121を参照．","0"
"211503","minor","211503","手動タイプライタ","Manual typewriters","機械式のタイプライタ．障害者が入力しやすい機構又は押しやすいキー構造になっていること．","0"
"211506","minor","211506","電動タイプライタ","Electric typewriters without memory","電動式のタイプライタ．手動タイプライタと同様に障害者が入力しやすいように工夫されていること．文書の保存・編集用メモリを持つものはワープロ専用機211509を参照．","0"
"211509","minor","211509","ワープロ専用機","Dedicated word-processors","ワープロ機能をもった専用機．文章編集用のメモリを持つ電動式タイプライタも含む．","0"
"211512","minor","211512","手動点字タイプライタ","Manual Braille writers","視覚障害者用に設計されたもので，点字を打つための機械式タイプライタ．","0"
"211515","minor","211515","電動点字タイプライタ","Electric Braille writers","視覚障害者用に設計されたもので，点字を打つための電動式タイプライタ．文章編集中に一時的にテキストデータを記憶しておくメモリを持つものも含む．","0"
"211518","minor","211518","ワープロ用ソフトウェア","Software for word-processing","ワープロ専用のソフトウェア．複雑な編集機能を備えた市販のソフトウェア，走査選択式により簡単な意志伝達を行うことに重点を置いたソフトウェアなどを含む．","0"
"211800","middle","211800","計算器","Calculators","計算のために用いる機械式及び電子式の計算器．パソコン用の計算ソフトウェアも含む．コンピュータ・タイプライタ・電卓用入出力装置は2109，多目的ソフトウェアは2121を参照．","0"
"211803","minor","211803","そろばん","Abacuses","玉をはじきやすくするために大形にしたり，滑べりにくくするなど，障害者用に工夫されているもの．レバーを倒すことで玉をはじくことの代用をする視覚障害者用のものも含む．","0"
"211806","minor","211806","電卓","Electronic calculators","主に四則演算程度の計算に用いるための卓上式の電子計算機．プログラム電卓及び関数電卓も含む．","0"
"211809","minor","211809","機械式の計算器","Non-electric calculators","電動及び手動で作動する機械式の計算器．計算尺も含む．","0"
"211812","minor","211812","計算用ソフトウェア","Software for calculation","コンピュータで計算するためのソフトウェア．表計算ソフトウェアのように複雑な計算機能を持つソフトウェアも含む．ワープロソフトなどに付随して組み込まれているものはワープロ用ソフトウェア211518を参照．","0"
"212100","middle","212100","多目的ソフトウェア","Multipurpose software","統合ソフトウェア及びユーティリティソフトウェアを含む．入出力変換用ソフトウェアは210927，ワープロ用ソフトウェアは211518，計算用ソフトウェアは211812，描画用ソフトウェアは212421，会話用ソフトウェアは214224を参照．","0"
"212400","middle","212400","描画用具・書字用具","Aids for drawing and handwriting","絵又は文字を書くための様々な自助具．肢体不自由者用及び視覚障害者用に工夫されていること．重垂バンドは034818，視覚障害者用地図（触地図）は123915を参照．","0"
"212403","minor","212403","筆記具","Pens,pencils,brushes,drawing compasses,straight edges and rulers","肢体不自由者及び視覚障害者用に握りやすかったり，目盛りが読みやすいように工夫された筆記具．ボールペン，鉛筆，毛筆，コンパス，直定規などを含む．把持具のアタッチメントは241806を参照．","0"
"212406","minor","212406","書字板・製図板・画板","Writing,drafting and drawing boards","ベッドサイド及び車いすで絵及び文字を書くための支えとなる板並びに台．","0"
"212409","minor","212409","署名ガイド・署名スタンプ","Signature guides and signature stamps","手書きでサインをするために用いるガイド及び手書きの代用をするスタンプ．肢体不自由者及び視覚障害者用に工夫されているもの．","0"
"212412","minor","212412","書字用フレーム","Writing frames","主に視覚障害者が利用するもので，行の位置が触覚でわかるもの．","0"
"212415","minor","212415","点字用具","Braille writing equipment","点字を打つための様々な道具．点字出力用紙は212418を参照．","0"
"212418","minor","212418","特殊紙（紙・プラスティック）","Special writing paper/ plastic","点字出力及び立体コピーに用いる専用紙，涎などによる汚れを防ぐ耐水性用紙などを含む．","0"
"212421","minor","212421","描画用ソフトウェア","Software for drawing and painting","絵を描いたり色を付けたりする専用のソフトウェア．ＣＡＤソフトウェアも含む．","0"
"212700","middle","212700","非光学式読書補助具","Non-optical reading aids","読書するために必要だが，レンズなどの光学的手段を利用していない様々な補助具．プリズムメガネ（寝た状態で使用するメガネ）は210333を参照．","0"
"212703","minor","212703","ページめくり機","Page turners","書見台に本，雑誌などを置き，スイッチを押すなどの簡単な操作でページをめくることのできる機械．主に肢体不自由者が使用する．","0"
"212706","minor","212706","書見台・書籍ホルダ","Book supports and book holders","自身の力で書籍を支えることのできない肢体不自由者が主として使用するもので，見開き状態の書籍を支えておくもの．","0"
"212790","minor","212790","タイポスコープ*","Typoscopes","紙全体からの光の反射を押えるために，黒色の遮蔽板又は遮蔽紙に１行程度の枠を空け，それをずらしながら文字を読むもの．主に弱視者，白内障患者などが読書をする際に使用する．","1"
"213000","middle","213000","録音機・受信機","Audio recorders and receivers","主に音声を記録・再生する機器又は電波で送られてくる音声を受信する機器．録音用テープに関する機器も含む．ヘッドホン・バイブレータは213903，マイクロホンは213909，ラジオ・テレビ用の接続装置は213912を参照．","0"
"213003","minor","213003","カセットテープレコーダ","Cassette tape recorders","標準のカセットテープを使用するテープレコーダ．ただし，標準のカセットテープを使用しているものの，ウォークマンに代表される小型で携帯用のテープレコーダは213009を参照．","0"
"213006","minor","213006","オープンリールテープレコーダ","Reel-to-reel recorders","オープンリールのテープを使用するテープレコーダ．","0"
"213009","minor","213009","小型テープレコーダ","Miniature tape recorders","カセットテープレコーダ213003及びオープンリールテープレコーダ213006を除いた小型のテープレコーダ．ウォークマンタイプの小型テープレコーダ及びマイクロカセットテープを使用するテープレコーダも含む．","0"
"213012","minor","213012","インデックストーンジェネレータ","Index tone generators","主として視覚障害者がテープを操作するために用いるもので，情報検索用のマーク又はアドレスをテープに書き込む装置．","0"
"213015","minor","213015","消磁器","Demagnetizers","各種のテープに書き込まれた内容を一度に消去するための装置．ヘッドの帯磁を消去するヘッドイレーザも含む．","0"
"213018","minor","213018","無線受信機","Radio receivers","ラジオ放送用受信機（いわゆる一般のラジオ）だけでなく，ハム用の受信機も含む．","0"
"213300","middle","213300","テレビ・ビデオ","Television and video equipment","放映された画像情報を受信したり，画像情報を記録・再生したりする機器．ラジオ・テレビ用の接続装置は213912を参照．","0"
"213303","minor","213303","テレビ受像機","Television sets","テレビ放送を受信する装置．字幕表示用デコーダ内蔵テレビは213309，テレビ内蔵パソコンはコンピュータ2112を参照．","0"
"213306","minor","213306","ビデオデッキ","Video recorders","磁気テープを使ってテレビの画像及び音声を記録・再生する装置．ＶＨＳ用だけでなく，８ミリビデオ用などのデッキを含む．またビデオ再生専用機も含む．","0"
"213309","minor","213309","字幕表示用デコーダ（字幕表示用デコーダ内蔵テレビ）","Decoders for videotext (text television)","通常のテレビ受像機に接続し，文字放送の字幕を表示させることのできる装置．テレビ本体又はビデオデッキ内にこの装置を組み込んでいるものも含む．","0"
"213312","minor","213312","閉回路テレビシステム（ＣＣＴＶ）","Closed circuit television systems","テレビカメラ及び受像機を同軸ケーブルなどで結び，特定の視聴者にのみ番組を見せることのできるテレビシステム．拡大読書機（拡大テレビ）は210603を参照．","0"
"213600","middle","213600","電話機・電話用機器","Telephones and aids for telephoning","公衆回線を使用して一般外部と通信を行なうための機器．インタ−ホン機能を合わせ持つ電話機も含む．インターホンは213915，玄関ホン・玄関ホン用アンプは213918を参照．","0"
"213603","minor","213603","標準電話機","Standard telephones","213606以下に含まれている各種の電話機を除くものが該当する．ただし、緊急通報機能をもった電話機は、個人用緊急通報システム215103を参照．","0"
"213606","minor","213606","移動電話機・自動車電話機","Mobile telephones and car telephones","原則として電波を使用して通信する機器で，携帯電話機（ＰＨＳを含む）及び車載電話機のこと．ポケットベルも含む．","0"
"213609","minor","213609","文字電話機","Telephones with text input and/or text output","キ−ボ−ドなどの手段によって入力された文字又は点字を電話回線で送ることができるもの．また，電話回線で送られてきた文字又は点字を紙，画面，点字ディスプレィなどに表示することができるもの．","0"
"213610","minor","213610","テレビ電話機*","Visual telephones and Vide ophones","音声・画像を同時に送受信する電話．玄関ホンにこの機能が付いているものは，玄関ホン・玄関ホン用アンプ213918を参照．","1"
"213611","minor","213611","自動応答装置*","Answering machines","留守又は何等かの理由で電話にでられない場合に自動的に応答する装置．留守録電話機を含む．","1"
"213612","minor","213612","スピ−カ付電話機及びアダプタ","Loudspeaking telephones and telephone attachments","受話音声をスピ−カより出力できる（スピ−カホン，ハンズフリーテレホン）電話機のこと．受話音声をテレホンピックアップなどで拾い，増幅してスピ−カより出力できるようにするアダプタを含む．また，標準電話機に取り付けて音声をスピ−カより出力するアダプタも含む．","0"
"213613","minor","213613","テレックス・ファックス*","Telex and telefax machines","電話回線を通して絵又は文字を送受信する装置．モデムなどによりコンピュ−タを電話回線に接続し，テレックス又はファックス機能を実現できるソフトウエアも含む．","1"
"213615","minor","213615","呼出音等表示装置","Dialling, engaged and ring tone indicators","電話の装置音が聞き取れない障害者に対して，相手を呼び出し中なのか，話し中なのか，つながって相手が出ているのかを光などで表示する装置．また，電話がかかかってきたことを光などに変換して知らせる装置も含む．","0"
"213618","minor","213618","ダイアル操作補助具","Dialling aids","ダイアルを回す又は押すといった操作が困難な人のための補助具．回転式ダイアルの位置が触ってわかるような盲人用アダプタ，プッシュボタンを押し易いようにした手先の不自由な人向きのキ−カバ−などを含む．","0"
"213621","minor","213621","受話器用アンプ","Receiver amplifiers","電話機の受話音量を拡大するための増幅器又はそのような機能を内蔵した電話機．携帯可能なものでは受話器の部分に被せて音を増幅し，小さなスピ−カで音として出力するもの又は磁気変化として出力するものがある．アンプはマイクロホン用及びヘッドホン用を含む．","0"
"213624","minor","213624","電話用機器のための接続装置","Connection units for telephoning aids","電話回線に接続するための接続ボックス，信号変換器，モデムなどのアダプタ類全てを含む．","0"
"213627","minor","213627","磁気コイル","Induction-coil plates","電話機などから漏れる磁気を電気信号に変換して出力するもの．補聴器を装用している難聴者が電話などの音声を聞きやすくするのが目的で，一般的にはテレホンピックアップとして販売されている．","0"
"213630","minor","213630","送受話器ホルダ","Receiver holders","送受話器を手で持っていられない人が使用する装置で，受話器を耳にあてた状態で保持する．電話機に直接取り付けられるヘッドセットを含む．","0"
"213633","minor","213633","電話切り替え器","Telephone switchboards","複数の電話機又は電話回線に接続する機器を（原則として手動で）切り替えるもの．","0"
"213689","minor","213689","その他の電話用機器*","Other aids for telephoning","受話音を振動で出力し，骨導で伝えることで（特に伝音性の難聴者に対して）明瞭な受話音を提供する骨伝導式電話機を含む．","1"
"213900","middle","213900","音伝達システム","Sound transmission systems","なんらかの方法で音を伝達する機器．ただし，録音機・受信機は2130，電話機・電話用機器は2136を参照．","0"
"213903","minor","213903","ヘッドホン・バイブレ−タ","Headphones and vibrators","耳に直接当てる受話器のことで，ヘッドホン，イヤホン，ヘッドセットなどは電話機を除いて全てここに含む．骨導バイブレ−タ端子，バイブレ−タ式ヘッドホン，リストバンド式バイブレ−タなども含む．振動椅子は034203を参照．","0"
"213906","minor","213906","スピ−カ","Loudspeakers","拡声器のことで，スピ−カユニット単体及び箱に取り付けられたものを含む．アンプを内蔵した電話機は，スピ−カ付電話機及びアダプタ213612を参照．","0"
"213909","minor","213909","マイクロホン","Microphones","送話器のこと．ヘッドセットに取り付けられている場合は，ヘッドホン・バイブレ−タ213903を参照．","0"
"213912","minor","213912","ラジオ・テレビ用の接続装置","Connection units to radio and television receivers","ラジオ・テレビの信号変換器，インピ−ダンス変換器などのことで，アンプ及び音量・音質調整機，ラジオ・テレビの音を録音するために使用するケ−ブル類を含む．また，補聴器に直接これらの音を入力するために使用するケ−ブル，アダプタも含む．さらに，補聴器に内蔵されている磁気コイルでこれらの音が聞こえるようにするアダプタ類も含む．","0"
"213915","minor","213915","インタ−ホン","Intercoms","屋内（自宅，施設など）で使用する，相手先が限られたインタ−ホンシステム．ただし，電話機でインタ−ホン機能を持つものの場合は，電話機・電話用機器2136を参照．","0"
"213918","minor","213918","玄関ホン・玄関ホン用アンプ","Entoryphones and entryphone amplifiers","玄関と屋内との間で通話するもの．ただし，玄関ホン機能を持つ電話機の場合は，電話機・電話用機器2136を参照．","0"
"213921","minor","213921","磁気ル−プシステム","Loop amplifiers,  loop receivers and loops","音声を直接磁気変換したり，搬送波に変調してル−プに送り出し，磁気コイルを内蔵している補聴器又は専用の受信機で多数の者が一度に音声を聞くことのできるシステム．主に公共施設のホ−ル，ろう学校の教室などに設置されている．磁気ル−プ用アンプ，磁気ル−プ受信機及び磁気ループを含む．また，可搬型のもの又は個人で使用できる小型のものも含む．","0"
"213924","minor","213924","ＦＭシステム","FM-systems","音などの情報をＦＭ電波で送り，専用の受信機（場合によっては一般のＦＭラジオを使用する）で受信するシステム．狭い範囲で一方向の情報伝達に使用する送信機・受信機を含む．一般的には，ＦＭワイヤレスマイクと呼ばれるものが該当する．","0"
"213927","minor","213927","赤外線システム","IR-systems","赤外線を使用してＦＭシステムと同様な情報伝達を行うシステム．電波と異なり，混信が少なく法的にも規制はないが，太陽光の関係で屋外では使用できない．一般向けにオ−ディオ用の送信機及び受信機が販売されており，受信機はヘッドホンに内蔵されている．赤外受信機内臓ヘッドホンも含む．","0"
"213930","minor","213930","双方向無線機器","Two-way radios","同時通話及び交互通話が可能なトランシ−バ．","0"
"214200","middle","214200","対話用機器","Face-to-face communication aids","基本的に，目の前にいる相手と会話をするための機器．ワ−プロ用ソフトウエアは211518を参照．","0"
"214203","minor","214203","文字・記号セット","Letter and/or symbol sets","意思伝達を目的とした文字・記号を記したチップ（文字積み木のようなもの）のセット．","0"
"214206","minor","214206","文字・記号ボ−ド","Letter and/or symbol boards","文字・記号を平面上に同時に提示し，それらを順次指し示すことで意思伝達を行うためのもの．","0"
