id,hierarchy_level,ccta95_code,name,name_en,description,is_marked
"122115","minor","122115","片手駆動式車いす","Single side driven non-powered wheelchairs","片手だけでハンドリムやレバーを駆動して操作する車いす．補装具の交付基準に示される手動チェーン型車いすは121809を参照．","0"
"122118","minor","122118","足駆動式車いす","Foot-driven wheelchairs","足だけで駆動し操作するためにつくられた車いす．遊具用カートは122718，いす付き歩行車は120609，椅子，座位保持装置は1809を参照．","0"
"122121","minor","122121","電動介助用車いす","Powered attendant-controlled wheelchairs","電動で駆動し，介助者が操作する車いす．介助用車いすは122103を参照．","0"
"122124","minor","122124","電動三輪車・電動四輪車","Electric-motor-driven wheelchairs with manual steering","電動で駆動し，使用者が手で駆動スイッチやハンドルを操作する，３輪あるいは４輪の車いす．","0"
"122127","minor","122127","電動車いす","Electric-motor-driven wheelchairs with powered steering","電動で駆動し，使用者がジョイスティックレバーなどの操縦装置で操作する車いす．パワーステアリング付きも含む．","0"
"122130","minor","122130","原動機付き車いす","Combustion-motor-driven wheelchairs","エンジンで駆動する車いす．エンジンで充電するハイブリッド電動車いすは，電動車いす122127に含む．","0"
"122133","minor","122133","モジュラ車いす","Wheelchair systems","部品の組み換えができ，車輪やシートの位置を調整できるフレームをベースとした車いす．システムの組み方によって，別の種類に変更できる．","0"
"122189","minor","122189","その他の車いす","Other wheelchairs","","0"
"122190","minor","122190","姿勢変換機能付き車いす*","Wheelchairs with the variable posture mechanisms","車いすとしての機能を持ち，かつ姿勢変換機能が付いている車いす．スタンダップ車いすや座席昇降車いす，リクライニング車いすなどがある．","1"
"122191","minor","122191","起立移動車*","Standing mobility devices","立位姿勢を保持することができ，両上肢を使って，車いすと同様の移動をすることができる移動器．","1"
"122400","middle","122400","車いす用品","Wheelchair accessories","単品で市販されている車いす用付属品．","0"
"122403","minor","122403","ステアリング装置・コントロール装置","Steering and control systems","電動車いすの駆動と操舵を制御する装置．上肢によるジョイスティックレバー制御装置や顎によるチンコントロール装置，１つのスイッチで制御する装置，複数のスイッチで制御する装置などがある．","0"
"122406","minor","122406","シート（座）・背もたれ・車いす用パッド・クッション","Seats and/or backrests","単体で市販されているシート，背もたれ，車いす用パッド，クッションのこと．","0"
"122409","minor","122409","駆動ユニット","Propulsion units","手動式車いすに装着して用いる駆動ユニットで，電動式と手動式がある．これらのユニットには操舵系，制御系，制動系を含んでよい．","0"
"122412","minor","122412","ライト・反射板","Lights","進行方向を照らしたり，車いすの存在を知らせるためのライト．反射板なども含む．","0"
"122415","minor","122415","トレイ・車いす用テーブル","Lap trays","膝の上に置いたり，車いすのフレームに装着して使用する台やテーブル．","0"
"122418","minor","122418","ブレーキ","Brakes","車いすの速度を制御する制動用ブレーキと，車いすが動かないようにする駐車用ブレーキなどがある．登り坂で車輪の逆転を防止する装置も含む．","0"
"122421","minor","122421","タイヤ・車輪","Tyres and wheels","車いすに用いるタイヤと車輪．キャスタを含む．タイヤには空気入りタイヤ，ソリッドタイヤなどがある．この他，タイヤと車輪が一体型になったものがある．","0"
"122424","minor","122424","バッテリ・充電器","Batteries and battery chargers","電動モータを駆動させる充電式電源と，その充電器．","0"
"122489","minor","122489","その他の車いす用品*","Other accessories for wheelchairs","ハンドリム，バックミラー，フレームプロテクタ，ストラップ，シートポケット，握りなどの車いす用品．","1"
"122700","middle","122700","その他の乗り物","Vehicles","自動車，自転車，モペット，オートバイ，車いす以外の，人の移動を目的として使用する個人用の移動機器．これらは，1209, 1215, 1218, 1221 を参照．","0"
"122703","minor","122703","バギー","Push-chairs","介助者が押したり引いたりして人の移動に使用する，ハンモック式のスリングシートの付いた手押し車．軽量でコンパクトに折りたたむことができるので携帯に便利．介助用車いすは122103を参照．","0"
"122706","minor","122706","乳母車","Prams","乳幼児用のいわゆる古典的な乳母車．","0"
"122709","minor","122709","そり","Sleds/sledges","介助者が，雪や氷の上をすべらせて人の移動に使用するそり．","0"
"122713","minor","122713","キック式そり","Kick-sleds","雪や氷の上を足で蹴ってすべらせて移動するそり．","0"
"122715","minor","122715","クローラ・移動用ボード","Crawlers and mobility boards","腹臥位や座位で乗り，自分で手や足で床を押して移動したり，介助者が引いたり押したりして移動する車輪付きボード．","0"
"122718","minor","122718","ストレッチャ・遊具用カート","Wheeled stretchers, pedal cars and playing carts","ストレッチャは，通常，臥位で人を乗せ，介助者が引いたり押したりして移動する車輪付き担架．車輪のないものも含む．遊具用カートは，ペダルを回転させたり，床を押したりして移動する小児用の遊具的な乗り物．","0"
"122721","minor","122721","動力付きビークル","Motorized vehicles (operated by the user)","使用者自身で操作できる，駆動，推進にエンジンやモータを用いた遊具用の移動機器．ゴーカートやスノースクータ（スノーモービル）を含む．低速度自動車は120906を参照．","0"
"122789","minor","122789","その他の乗り物","Vehicles","","0"
"123000","middle","123000","移乗補助用具","Transfer aids","本人あるいは介助者が，移乗時の補助に用いる器具．支持用具は1818，携帯用スロープは183015を参照．固定用スロープは183018を参照．","0"
"123003","minor","123003","スライディングボード・スライディングマット","Sliding boards and sliding mats","本人あるいは介助者が，ベッドと車いす間等の移乗時に，補助として用いる橋渡し板やマット．この上に，殿部を乗せて腰掛け，徐々に身体をずらせながら移動して移乗したり，移乗させたりする．","0"
"123006","minor","123006","ターンテーブル","Turntables","ベッドと車いす間等を移乗したり，移乗させたりするときに補助として用いる回転盤．通常，床の上に置き，両下肢をその上に乗せて使用し，移乗時の身体の向きを変えやすくするのに用いる．浴槽への出入りのために，浴槽台や浴槽の上に置き，殿部を乗せて身体を回転させやすくするのにも利用する．","0"
"123009","minor","123009","床置き式起き上がり用手すり","Free-standing rails for self-lifting","自分で起き上がるのに用いる，床置き式の手すり．ベッド用サイドレール，ベッド固定式起き上がり手すりは181227を参照．","0"
"123012","minor","123012","なわばしご","Rope ladders","自分で起き上がるのに用いる，なわばしご状の器具．","0"
"123015","minor","123015","起き上がり用ベルト・ハーネス","Lifting belts and harnesses","自分で起き上がるのに用いる，ベルトやハーネス．通称，モンキーバーと呼ばれるものは181227参照．","0"
"123089","minor","123089","その他の移乗補助用具","Other transfer aids","","0"
"123300","middle","123300","体位変換用具","Turning aids","体位を転回・変換するのに用いる器具．移乗時の補助として利用できるものもある．","0"
"123303","minor","123303","体位変換用クッション","Lifting and turning cushions","身体の一部を持ち上げたり，回転させた後に，その体位を保持するのに用いる体位変換用のクッション．通称，リフパッドと呼ばれる，ロール状のエアバックに棒を差し込んだものも含む．","0"
"123306","minor","123306","体位変換用シーツ","Turning sheets and turning carpets","体位変換に使用する，滑りやすい裏地を用いた１枚もののシーツやカーペット，あるいは内面に滑りやすい生地を用いたロール状のシーツやカーペット．ロール状のものは，上に乗せた人を押したり引っ張ると，シーツやカーペットが回転して体位変換ができる．","0"
"123389","minor","123389","その他の体位変換用具","Other turning aids","","0"
"123600","middle","123600","リフト","Lifting aids","自力では移乗できない人を移乗させるのに使用する機器で，吊り具により人を吊り上げて使用する方式のものと，椅子や担架などの台座により人を持ち上げて使用する方式のものとがある．両者を使い分ける必要がある場合は，便宜上人を吊り上げて使用するものを吊り上げ式，人を持ち上げて使用するものを台座式と呼称することで区分する． 自動車用吊り上げ式リフトは121215，自動車用車いすリフトは121218参照．乗用エレベータは183003を参照．段差解消機は183006，階段昇降機は183009を参照．","0"
"123603","minor","123603","吊り上げ式床走行リフト","Wheeled hoists with sling seats","自力では移乗できない人をシート状やベルト状などの吊り具を使って，座位や臥位などで吊り上げ，床を移動し目的の場所に移乗させるリフト．","0"
"123606","minor","123606","台座式床走行リフト","Wheeled hoists with solid seats","自力では移乗できない人を機器に備え付けられた椅子や担架などの台座を使って身体を保持し，座位や臥位で持ち上げ，床を移動し目的の場所に移乗させるリフト．","0"
"123609","minor","123609","吊り上げ式天井走行リフト","Hoist trolleys","自力では移乗できない人をシート状やベルト状などの吊具を使って，座位や臥位などで天井から吊り上げ，天井レールに沿って移動し，目的の場所に移乗させるリフト．","0"
"123612","minor","123612","住宅用設置型リフト","Stationary hoists fixed to the wall/walls, floor and/or ceiling","住宅の壁，床などに固定設置し，その機器の可動範囲内で，自力では移乗できない人を移乗させるリフト．吊り具により人を吊り上げて使用する方式のものと，椅子や担架などの台座により人を持ち上げて使用する方式のものとがある．","0"
"123615","minor","123615","機器用設置型リフト","Stationary hoists fixed to, mounted in or on another product","浴槽やベッドなどの機器に固定設置し，その機器の可動範囲内で，自力では移乗できない人を移乗させるリフト．吊り具により人を吊り上げて使用する方式のものと，椅子や担架などの台座により人を持ち上げて使用する方式のものとがある．","0"
"123618","minor","123618","据置型リフト","Stationary free-standing hoists","床に置いてその機器の可動範囲内で，自力では移乗できない人をシート状やベルト状などの吊具を使って移乗させるリフトと，浴槽内の人の昇降に使用する浴槽内用リフトなどがある．段差解消機は183006を参照．","0"
"123621","minor","123621","吊り上げ式リフト用吊具","Body support units for hoists","人を吊り上げて使用する床走行型，天井走行型，設置型，据置型リフトの吊り具．吊り上げ式シート（座）や担架を含む．","0"
"123624","minor","123624","簡易リフト","Carrying chairs, harnesses and baskets","自力では移乗できない人を胸腹部を支えて持ち上げたり，ハーネスで臀部を引き上げたりして移乗させるリフト．こまわりさん，カールくん，マイリフティなどがある．負ぶい紐を含む．","0"
"123689","minor","123689","その他のリフト","Other lifting aids","","0"
"123900","middle","123900","視覚障害者用（移動支援）機器","Orientation aids","視覚障害者が移動のために，位置，方向，状態を知るための補助機器．音声で表現した音声式，触って分かるようにした触知式，弱視者のための視覚補助具がある．弱視者用視覚補助具は210321，210336参照．","0"
"123903","minor","123903","白杖","Tactile (white) sticks","視覚障害者が移動時に，路面を探ったり，障害物を探したりするためのもので，直杖式，折たたみ式，伸縮式のものがある．柄の部分が白く塗られており，視覚障害者のシンボルともなっている．石突き（チップ），反射テープなどの付属品も含む．ステッキ，Ｔ字杖は120303を参照．","0"
"123906","minor","123906","電子式歩行補助具","Electronic orientation aids","超音波を利用して，物体までの距離，方向などを音や振動で表現した歩行補助具．その他にレーザー光線を利用したものもある．眼鏡や白杖に組み込まれたり，手持ち式のものがある．","0"
"123909","minor","123909","音声式歩行誘導装置","Acoustic navigation aids (sound beacons)","音や音声案内により誘導する装置．","0"
"123912","minor","123912","視覚障害者用コンパス","Compasses","手で触って分かるように，コンパスの上に点字等で方位が表示されているものや，北に向けると音がでるものがある．","0"
"123915","minor","123915","視覚障害者用地図（触地図）","Relief maps","手で触ってわかるように，凸状になっている地図．","0"
"129000","middle","129000","オートバイ*","Motorcycles","自転車から進化したもので，２輪または３輪で構成された自動車．二輪自動車の横に１輪の側車（サイドカー）を固着したものや，荷物または人の輸送に用いられる側車付き二輪自動車，スクータも含む．モペットは1215を参照．なお，オートバイと 1215 モペット[Mopeds] の区別は我が国の道路交通法を考慮したものである．","1"
"150000","major","150000","家事用具","Aids for housekeeping","炊事，洗濯，掃除，裁縫，その他の家事役割を遂行するための設備品や道具，また食事動作に必要とされる食事用の器や用具．障害者が使用しやすい工夫がされている．","0"
"150300","middle","150300","炊事用具","Aids for preparing food and drink","料理の下ごしらえ，調理，後片付け等の一連の炊事動作を行うときに使用される器具．把持しやすいように取っ手を工夫したもの，安定性を良くしたもの，複雑な動作を要せずに扱えるように工夫された冷蔵庫・冷凍庫などである．表示・指示器は2403を，瓶の蓋開けや，缶切りなどの容器取扱器具は2406を，把持具アタッチメントは241806を，滑りどめシート・パットは242706を参照．","0"
"150303","minor","150303","計量・計測器具","Aids for weighing and measuring","料理材料の分量や，カロリー，調理時間，湯の温度を測るための器具類．キッチンスケール，カロリースケール，計量カップ・スプーン，料理用温度計，バター切り器，タイマ及び液体レベル表示器など．点字や大きな文字による表示をして見やすくする，軽量にする，大きな取っ手をつけて持ちやすくする，固定性を良くする，均等に切るためのガイドをつけるなどの工夫がされている．測定用具は2706を参照．","0"
"150306","minor","150306","切り分け器具","Aids for cutting, chopping, and dividing","料理の材料の下ごしらえで，材料を様々な形に切る，すり下ろす，調理品を切り分ける等の動作を容易にするための器具類．スライス器，包丁，まな板，チーズスライサ，卵切り器，卵黄分離器、たまねぎホルダ，おろし金及び万能調理器などがある．滑りどめ固定金具をとりつける，柄を太くする，柄の角度を変えるなどの工夫がされている．料理準備機器は150315を参照．","0"
"150309","minor","150309","洗浄・皮むき用具","Aids for cleaning and peeling","料理の下ごしらえ，野菜を洗ったり，皮をむいたりするときに使用される器具類．取っ手をつけたり，簡単な動作で取り扱えるように工夫されている野菜洗い用ブラシ，皮むき器（手動・電動），じゃがいもホルダ及び芯取り用ナイフなどである．料理準備機器は150315を参照．","0"
"150312","minor","150312","オ−ブン料理用具","Aids for baking","オ−ブンを使って料理をするときに使用される器具類．手入れしやすい，持ちやすい，大きなスイッチを取り付ける，単純な動作で扱えるなどの工夫がされている．めん棒と焼き型，耐熱容器などがある．料理準備機器は150315を参照．","0"
"150315","minor","150315","料理準備機器","Machines for food preparation","料理の下ごしらえを手早くかつ容易にするために使用される，電気製品や器具類．扱いやすいように特別に開発されたフードミキサ，フードプロセッサ及び泡たて器（手動・電動）などである．","0"
"150318","minor","150318","調理用具","Aids for cooking and frying","調理で行われる，型どる，材料を挟む，煮炊きするなどに使用される様々な器具類．取っ手やスイッチの工夫がされ，手入れのしやすい調理用皿，フライパン，卵ゆで器，コーヒーメーカ，ティーメーカ，鍋用ホルダ，こし器，フライパン用ふた，ざる，ボール，目玉焼き用リング，フライばさみ，鍋及びその他の台所用具などである．","0"
"150321","minor","150321","レンジ・オ−ブン類","Cooking units","レンジ料理，オ−ブン料理，煮炊き，出来上がった料理を温める，保温する等に使用される，台所ユニットに組み込まれた加熱調理器具．軽い力や単純な動作で操作できるスイッチや開閉しやすい扉がついているもの，高さの調節が行えるなどの工夫がされている．ホットプレートのような卓上用加熱調理器具や魔法瓶等の食卓用具は150903を参照．","0"
"150324","minor","150324","冷蔵庫・冷凍庫","Refrigerators and freezers","一定期間，素材や調理品を冷却・冷凍保存するための電気器具．扉の開け易さ，食品の出し入れに対する工夫がされている．","0"
"150390","minor","150390","調理台*","Cooking table","料理の下ごしらえを行うために使用される設備品．高さの調節ができるものや下部が空間になっているものなど，接近しやすく作業しやすいように配慮されたデザインのものがある．","1"
"150600","middle","150600","炊事用具・食事用具の洗浄器具","Aids for dishwashing","炊事用具や食器を清浄にするために使用される，スポンジ，たわし，洗い桶など．取っ手がついたもの，ミトン型のもの，吸盤付きのものなどがある．","0"
"150603","minor","150603","流し台","Sinks","炊事用具や材料及び食器を清浄にするために使用される設備品．高さが調節できるものや下部に空間があるものなど，接近しやすく作業しやすいように配慮されたデザインのものがある．","0"
"150606","minor","150606","炊事用具・食器洗浄ブラシ","Dishwashing brushes and flask brushes","炊事用具や皿，びんなどを清浄にするときに使用される特別なスポンジ，たわし及びブラシ．","0"
"150609","minor","150609","水切り","Dish drainers","皿などを濡れたまま置いておき，水を切るための器具．パイプがついていて，排水が自動的に行われるものや，皿が倒れないように仕切がついたものなどがある．","0"
"150612","minor","150612","排水溝フィルタ・オ−バ−フロ−パイプ","Outlet filters and overflow pipes","排水溝フィルタは流し台の排水口にセットし，ゴミを集めるための容器．オ−バ−フロ−パイプは流し台から水があふれるのを防ぐための排水パイプである．いずれもごみを取り出しやすく，また手入れしやすいように工夫されたものがある．","0"
"150615","minor","150615","ふきん絞り機","Dish-cloth wringers","ふきんの水を絞り出すための器具．２本のロ−ルの間にふきんを引き込んで圧縮し，脱水する．","0"
"150618","minor","150618","食器洗い機","Dishwashers","汚れた食器を洗浄するための電気器具．軽い力で操作できる扉やスイッチがついたもの，食器の出し入れをしやすくしたものなどがある．乾燥機能を備えたものもある．","0"
"150900","middle","150900","食事用具","Aids for eating and drinking","皿やカップ，グラス，スプ−ン，フォ−ク，ナイフ及び食物を温めておく器具や食事用具など，食事に必要な器や用具．重錘バンドは034818を，容器取扱器具は2406を，把持具アタッチメントは241806を，滑りどめシート・パッドは242706を参照．","0"
"150903","minor","150903","食卓用具","Aids for serving food and drink","食卓で使われ，一時的に保温又は冷却するための器具あるいは食卓上で調理したり暖め直したりするための器具，及び，保存し，取り分けるための器具類．ホットプレートや鍋の保温器，魔法瓶等を含む．魔法瓶は軽いものや，食卓に置いたまま簡単な操作で飲み物を注げるものがある．運搬用具は2436を参照．","0"
"150906","minor","150906","定量取り出し容器","Suger dispensers","一定量の砂糖，塩，ソースなどの調味料類を，手で押したり傾けたりして取り出す器具，及び容器内のものを小分けにして取り出すための器具．","0"
"150909","minor","150909","ビン栓・じょうご","Stoppers and funnels","容器の口にはめて中のものを取り出したり，流出を防ぐための器具．持ちやすいように，また落ちないように工夫されたものがある．","0"
"150989","minor","150989","その他の食事用具","Other aids for eating and drinking","","0"
"150912","minor","150912","摂食用具","Cutlery","ナイフ，フォ−ク，スプ−ン及び箸など，食物を食べやすい大きさに分けて，刺したり，すくったり，挟んだりして，口に運ぶ器具類．いずれもその柄を太くする，安定性を高めるために重量を加える，口に食物が入りやすくするために角度をつけるなどの工夫がされている．ナイフの刃にカ−ブをつけ，片手で容易に切れるものもある．把持具アタッチメントは241806を参照．","0"
"150915","minor","150915","飲み物用具","Mugs and glasses, cups and saucers, and straws","飲み物をその中に入れて飲むための食器及び用具すなわち，ジョッキとグラス類，カップと受け皿，ストロ−等．取っ手を大きくして持ちやすくする工夫をしたもの，ストロ−を固定できるカップ，吸い口のついたカップ，手に引っかけて把持できるカップ長さや角度の調整ができて届きやすくできるストローなどがある．把持具アタッチメントは241806を参照．","0"
"150918","minor","150918","皿と碗","Plates","食物を盛る器で，こぼれにくく，すくいやすい，また安定性の良い等配慮された，浅く平らな器及び鉢状の器．保温皿，パンを固定するプレート，陶磁器なども含む．","0"
"150921","minor","150921","フ−ドガ−ド","Pusher edges and plate buffers","皿の周囲に取り付け，皿の中の食物がすくう時に外にこぼれないようにする器具．","0"
